{
  "$schema": "https://json-schema.org/draft/2020-12/schema",
  "title": "GroupRequestedCreateData",
  "description": "data de requested com operation create do Grupo (ipm.group). Publicado somente pelo Receiver.",
  "x-schemaVersion": "1.0",
  "type": "object",
  "additionalProperties": false,
  "required": [
    "operationId",
    "requestDigest",
    "specification"
  ],
  "properties": {
    "operationId": {
      "$ref": "../../common/definitions.v1.schema.json#/$defs/opaqueIdentifier",
      "x-writer": "server",
      "x-sensitivity": "internal"
    },
    "requestDigest": {
      "$ref": "../../common/definitions.v1.schema.json#/$defs/requestDigest",
      "x-writer": "server",
      "x-sensitivity": "internal"
    },
    "specification": {
      "title": "GroupCreateSpecification",
      "type": "object",
      "additionalProperties": false,
      "required": [
        "organizationId",
        "name",
        "description"
      ],
      "x-writer": "client",
      "x-sensitivity": "internal",
      "properties": {
        "organizationId": {
          "$ref": "../../common/definitions.v1.schema.json#/$defs/resourceId",
          "x-writer": "client",
          "x-sensitivity": "internal"
        },
        "name": {
          "$ref": "definitions.v1.schema.json#/$defs/groupName",
          "x-writer": "client",
          "x-sensitivity": "public"
        },
        "description": {
          "$ref": "definitions.v1.schema.json#/$defs/description",
          "x-writer": "client",
          "x-sensitivity": "public"
        },
        "roles": {
          "$ref": "definitions.v1.schema.json#/$defs/roles",
          "x-writer": "client",
          "x-sensitivity": "internal"
        },
        "deletionProtection": {
          "$ref": "../../common/definitions.v1.schema.json#/$defs/deletionProtection",
          "x-writer": "client",
          "x-sensitivity": "internal"
        }
      }
    },
    "organizationQuotaLimit": {
      "description": "Limite de grupos da Organization, definido pelo Receiver (ausente para operadores: sem cota). O Manager aplica o limite na mesma unidade atômica do pedido, sob trava por Organization (decisão 0088).",
      "type": "integer",
      "minimum": 1,
      "maximum": 1000,
      "x-writer": "server",
      "x-sensitivity": "internal"
    }
  }
}
