{
  "operationId": "0199c8b3-0a1b-7c2d-8e3f-4a5b6c7d8e01",
  "requestDigest": "5f2b8c0e7d4a1b9c3e6f0a2d8b5c7e1f4a9d2c6b0e8f3a7d1c5b9e2f6a0d4c8b",
  "specification": {
    "organizationId": "0199c8a4-7b1e-7c3a-9f2d-5e8a1b2c3d4e",
    "name": "finops",
    "description": "Equipe de FinOps da Organization",
    "roles": [
      "bsm.accountViewer",
      "ipm.userViewer"
    ],
    "deletionProtection": false
  },
  "organizationQuotaLimit": 10
}
